Wee Heavy;"All of the Scottish ales share the same description and are differentiated mainly based on gravity and alcoholic strength. The Scottish ales follow in the English tradition of having a confusing naming convention. The names are steeped in tradition and history, one thing the Scottish are famous for. To start with are the Schilling designations. These are remnants of the 1870 rating system in which the price of beer, including the taxes, was rated in the old pre-decimal shillings. 60 Shillings was a light ale; 70 Shillings was a heavy ale; 80 Shillings was an export; and 90+ Shillings was a barley-wine known as 'Wee Heavy'";;;;;;;;;;;;;;;;;;;;
Weissbier;Weisse is a top-fermented, bottle conditioned wheat beer made with both traditional warm-fermenting yeasts and lactobacillus culture. They have a rapidly vanishing head and a clear, pale golden straw-coloured appearance. The taste is refreshing, tart, sour and acidic, with a lemony-citric fruit sharpness and almost no hop bitterness.;;;;;;;;;;;;;;;;;;;;
Weizenbock;Weizenbock is a strong German wheat beer. It is similar to a Hefeweizen, although darker and higher in malt flavor and alcohol. To be considered in this style, German law requires at least 50% wheat malt to be used in the brewing process. This style uses ale yeast, and gets a slightly spicy tone from the yeast. Color should be medium red-brown or darker, with a cloudy appearance. Aroma and taste should be highlighted by both wheat sweetness and malt characteristics such as caramel. ABV is likewise higher than pale German wheat style, usually 6% or higher.;;;;;;;;;;;;;;;;;;;;
Wheatwine;A Wheat Wine (also called an American Style Wheat Wine) is a stronger wheat beer that is brewed with 50% or more wheat malt. The color ranges from gold to dark amber. The style is full bodied and has a high malt sweetness. Hop presence should be medium to low in both aroma and flavor. Fruit tones should be noted in both aroma and taste. Other style notes include bready, wheat, honey or caramel notes. ABV should be in the range of 8% to 12%. IBUs are medium at 40-80, usually at the lower end of the range.;;;;;;;;;;;;;;;;;;;;
White IPA;Braven’s flagship beer, like its Co-Founders, lives just a step off the beaten path. A delicious blend of two distinct styles, Braven White delivers the hoppy bite of an American IPA that’s balanced by the soft wheat character and hints of spice of a Belgian White. Our unique White IPA offers maximum character and flavor in every easy-to-drink pint.;;;;;;;;;;;;;;;;;;;;
Witbier;"Witbier (literally, ""white beer"" in Belgium) is one Belgian version of a wheat beer. It is also sometimes called a ""Witte"". The color should be straw yellow to gold, with a notable cloudy haze. A true historical rendering of the style will not use hops, but instead a mixture of spices, herbs and orange. However, current versions of the style generally include hops as a portion of the mixture (or ""gruit""). Despite that fact, the hop presence in both aroma and flavor should be minimal. However, there should be a notable citrus or slight acidity present. ABV should be somewhat low.";;;;;;;;;;;;;;;;;;;;
